<?xml version="1.0" encoding="UTF-8"?>
<tns:conf xmlns:id="http://x-road.eu/xsd/identifiers" xmlns:tns="http://x-road.eu/xsd/xroad.xsd"
    xmlns:xsi="http://www.w3.org/2001/XMLSchema-instance"
    xsi:schemaLocation="http://x-road.eu/xsd/xroad.xsd ../../../../common-util/src/main/resources/globalconf.xsd ">
    <instanceIdentifier>EE</instanceIdentifier>

    <member id="producerId">
        <memberClass>BUSINESS</memberClass>
        <memberCode>producer</memberCode>
        <name>Experimental producer</name>
    </member>
    
    <member id="consumerId">
        <memberClass>BUSINESS</memberClass>
        <memberCode>consumer</memberCode>
        <name>Experimental consumer</name>
    </member>

    <!-- <group> <shortName>shortName</shortName> <fullName>fullName</fullName> 
        <org>org</org> </group> <tsp> <name>name</name> <url>url</url> <cert>TODO 
        - WHICH CERT?</cert> </tsp> -->


    <pki>
        <name>pki1</name>
        <topCA>
            <!-- Extracted from: proxy/src/test/certs/admin-ca1.pem -->
            <cert>MIIDUzCCAjugAwIBAgIIU1eWoysptjUwDQYJKoZIhvcNAQEFBQAwNzERMA8GA1UE
                AwwIQWRtaW5DQTExFTATBgNVBAoMDEVKQkNBIFNhbXBsZTELMAkGA1UEBhMCU0Uw
                HhcNMTIwNjE0MTAwNDI5WhcNMjIwNjEyMTAwNDI5WjA3MREwDwYDVQQDDAhBZG1p
                bkNBMTEVMBMGA1UECgwMRUpCQ0EgU2FtcGxlMQswCQYDVQQGEwJTRTCCASIwDQYJ
                KoZIhvcNAQEBBQADggEPADCCAQoCggEBAILYKYehC6hsbPQnqBPWoatI8I7qZGow
                3otWO9pW8lMvjgNiE8Cl8oFQS+C3CaqSvHU+iXUVkIlHuAr6k30G/mm6JqU0zA2o
                2apt5HJFzkg/0/LvLbSB1S5e0VTRDhMncgJakEUJvHFL0aKtq1RigP9C7Zt5BdDy
                RBuJiutvaFjSeJ2sCQrHDcrJ1uAtdidv3z3Zih9O8CnalNZFltFf7M8pm+O+HIbu
                miA19kShJwvpcdC9fVPuwsF1Qbeo4SeKuDPU1KHq7ZP9Heh7P6eywxghkYC4yewj
                Bu8COi1FJMGHt9OdD+rNa/GTZ7ULPFiCH8wwCTn+YUtFe5pFLkvCG7sCAwEAAaNj
                MGEwHQYDVR0OBBYEFHctiS4Dtv340mU5MTUi0EYa6NIJMA8GA1UdEwEB/wQFMAMB
                Af8wHwYDVR0jBBgwFoAUdy2JLgO2/fjSZTkxNSLQRhro0gkwDgYDVR0PAQH/BAQD
                AgGGMA0GCSqGSIb3DQEBBQUAA4IBAQAnEhhOwvk2Goy+wRwZgQLkmv9QIzBwP+Bw
                d45DQOJyPjVTukNoc5w1y1in7yR9T8Cv5Ba1ctAqclztwjhAYAhWcG/CSZ4RvX8z
                ysbnthW6qhZGGz5KJATZhFYrIaNGqC9i0FfTe3PF3HaowqndnBFtwjV65mszTaTN
                p94LKhLk1ARc/BidplsM1cBSoA9VWvTANI8alKuJxh1QG9TbEJul1BTzA/wItMVD
                tganTDrQxmkP1NW7d+MsIB5AQHABaXWgjygcqoMlLjyH/0QOP13iyvMXQU4jtSla
                TmGm9CaC/xRQ10YD7AHHvq1P2cvfbQaV3I5xUYF7aqwM93ZjmptI
            </cert>
            <ocsp>
                <!-- Local OCSP responder simulator used currently -->
                <url>
	http://127.0.0.1:8082/ocsp</url>
                <!-- Extracted from: proxy/src/test/certs/ocspsigner.p12 -->
                <cert>MIIDizCCAnOgAwIBAgIIOmOWEyqjUj0wDQYJKoZIhvcNAQEFBQAwNzERMA8GA1UE
                    AwwIQWRtaW5DQTExFTATBgNVBAoMDEVKQkNBIFNhbXBsZTELMAkGA1UEBhMCU0Uw
                    HhcNMTIwOTA2MTEzODMwWhcNMTQwOTA2MTEzODMwWjAWMRQwEgYDVQQDDAtPY3Nw
                    IFNpZ25lcjCCASIwDQYJKoZIhvcNAQEBBQADggEPADCCAQoCggEBANZTdnxNq1QM
                    ncmiInNUSpm02V72GNrMrvq2Q4Zz3Zr8zDKMdAiwdrjx9X+Zi5oTjiSUXRuHY5ZN
                    9oeLO1cv9NV6OGk3MlrAzxquBfQUgnZMNLkPZW5SuLqlZpWf0vF7EvAVX20hxgMq
                    7M26Fxt/B9W81/G/REnuHKJ+nxCAZi5Kd1hdGVTEIwkicqROiEfQUcycs0T5aZI7
                    F5qFiZyo3AeRbWYyhEfe326cPaRaswo2WwcBjFYWibTCnNQuLgDL6qroL1T8soI6
                    LzBaNao6Lm4YY1OwTPz/UEiJ3KIXoAjfxMlOUnznmeWYNPcJb5Z8fdtWpaZqjV3W
                    IMAZocNThb8CAwEAAaOBuzCBuDBYBggrBgEFBQcBAQRMMEowSAYIKwYBBQUHMAGG
                    PGh0dHA6Ly9pa3MyLXVidW50dS5jeWJlci5lZTo4MDgwL2VqYmNhL3B1YmxpY3dl
                    Yi9zdGF0dXMvb2NzcDAdBgNVHQ4EFgQUI1mSgzcFjcBFmmjYwlc9Qm7yF/kwDAYD
                    VR0TAQH/BAIwADAfBgNVHSMEGDAWgBR3LYkuA7b9+NJlOTE1ItBGGujSCTAOBgNV
                    HQ8BAf8EBAMCBeAwDQYJKoZIhvcNAQEFBQADggEBACRO2KTCVKQxYMlsMDkjT5Qj
                    zqW0wHNCsxieYv0qfDM1Z5ceW0c0KjJcKXESj7GXT7oNejwI4gZNgxIzemJ3xABH
                    dftk2WxLQBYJMKQ30EuisFKueqpxaLVkPAbt+XLxSrxaYePB9LTJ+rw3FtbiIbag
                    3AH22TFUUUnaTGVF+OiHtthE1u7bnwsTqWXX4PI9I3KnSaIEE55mveNq2jHVWu4r
                    Myy2flOZMonYh3dw1gmSp2yWo1YDpN3olM0Li6Lnfvg1TZd71xZ6ZkKf+MoAs+pW
                    2HaLh8hiYRXpgw3WVSBg6CPTLoU5xFb57BNL3qccVetmbpZgznHMYEBN4b4pyHk=
                </cert>
            </ocsp>
            <ocsp>
                <url>http://nihhuijaa.example.net/ocsp</url>
                <cert>MIIDizCCAnOgAwIBAgIIOmOWEyqjUj0wDQYJKoZIhvcNAQEFBQAwNzERMA8GA1UE
                    AwwIQWRtaW5DQTExFTATBgNVBAoMDEVKQkNBIFNhbXBsZTELMAkGA1UEBhMCU0Uw
                    HhcNMTIwOTA2MTEzODMwWhcNMTQwOTA2MTEzODMwWjAWMRQwEgYDVQQDDAtPY3Nw
                    IFNpZ25lcjCCASIwDQYJKoZIhvcNAQEBBQADggEPADCCAQoCggEBANZTdnxNq1QM
                    ncmiInNUSpm02V72GNrMrvq2Q4Zz3Zr8zDKMdAiwdrjx9X+Zi5oTjiSUXRuHY5ZN
                    9oeLO1cv9NV6OGk3MlrAzxquBfQUgnZMNLkPZW5SuLqlZpWf0vF7EvAVX20hxgMq
                    7M26Fxt/B9W81/G/REnuHKJ+nxCAZi5Kd1hdGVTEIwkicqROiEfQUcycs0T5aZI7
                    F5qFiZyo3AeRbWYyhEfe326cPaRaswo2WwcBjFYWibTCnNQuLgDL6qroL1T8soI6
                    LzBaNao6Lm4YY1OwTPz/UEiJ3KIXoAjfxMlOUnznmeWYNPcJb5Z8fdtWpaZqjV3W
                    IMAZocNThb8CAwEAAaOBuzCBuDBYBggrBgEFBQcBAQRMMEowSAYIKwYBBQUHMAGG
                    PGh0dHA6Ly9pa3MyLXVidW50dS5jeWJlci5lZTo4MDgwL2VqYmNhL3B1YmxpY3dl
                    Yi9zdGF0dXMvb2NzcDAdBgNVHQ4EFgQUI1mSgzcFjcBFmmjYwlc9Qm7yF/kwDAYD
                    VR0TAQH/BAIwADAfBgNVHSMEGDAWgBR3LYkuA7b9+NJlOTE1ItBGGujSCTAOBgNV
                    HQ8BAf8EBAMCBeAwDQYJKoZIhvcNAQEFBQADggEBACRO2KTCVKQxYMlsMDkjT5Qj
                    zqW0wHNCsxieYv0qfDM1Z5ceW0c0KjJcKXESj7GXT7oNejwI4gZNgxIzemJ3xABH
                    dftk2WxLQBYJMKQ30EuisFKueqpxaLVkPAbt+XLxSrxaYePB9LTJ+rw3FtbiIbag
                    3AH22TFUUUnaTGVF+OiHtthE1u7bnwsTqWXX4PI9I3KnSaIEE55mveNq2jHVWu4r
                    Myy2flOZMonYh3dw1gmSp2yWo1YDpN3olM0Li6Lnfvg1TZd71xZ6ZkKf+MoAs+pW
                    2HaLh8hiYRXpgw3WVSBg6CPTLoU5xFb57BNL3qccVetmbpZgznHMYEBN4b4pyHk=
                </cert>
            </ocsp>
        </topCA>
        <nameExtractor>
            <memberClass>BUSINESS</memberClass>
            <methodName>ee.ria.xroad.common.cert.CertHelper.getSubjectCommonName</methodName>
        </nameExtractor>
    </pki>
    <pki>
        <name>pki2</name>
        <authenticationOnly>true</authenticationOnly>
        <topCA>
            <!-- Extracted from: proxy/src/test/certs/admin-ca1.pem -->
            <cert>MIIDUzCCAjugAwIBAgIIU1eWoysptjUwDQYJKoZIhvcNAQEFBQAwNzERMA8GA1UE
                AwwIQWRtaW5DQTExFTATBgNVBAoMDEVKQkNBIFNhbXBsZTELMAkGA1UEBhMCU0Uw
                HhcNMTIwNjE0MTAwNDI5WhcNMjIwNjEyMTAwNDI5WjA3MREwDwYDVQQDDAhBZG1p
                bkNBMTEVMBMGA1UECgwMRUpCQ0EgU2FtcGxlMQswCQYDVQQGEwJTRTCCASIwDQYJ
                KoZIhvcNAQEBBQADggEPADCCAQoCggEBAILYKYehC6hsbPQnqBPWoatI8I7qZGow
                3otWO9pW8lMvjgNiE8Cl8oFQS+C3CaqSvHU+iXUVkIlHuAr6k30G/mm6JqU0zA2o
                2apt5HJFzkg/0/LvLbSB1S5e0VTRDhMncgJakEUJvHFL0aKtq1RigP9C7Zt5BdDy
                RBuJiutvaFjSeJ2sCQrHDcrJ1uAtdidv3z3Zih9O8CnalNZFltFf7M8pm+O+HIbu
                miA19kShJwvpcdC9fVPuwsF1Qbeo4SeKuDPU1KHq7ZP9Heh7P6eywxghkYC4yewj
                Bu8COi1FJMGHt9OdD+rNa/GTZ7ULPFiCH8wwCTn+YUtFe5pFLkvCG7sCAwEAAaNj
                MGEwHQYDVR0OBBYEFHctiS4Dtv340mU5MTUi0EYa6NIJMA8GA1UdEwEB/wQFMAMB
                Af8wHwYDVR0jBBgwFoAUdy2JLgO2/fjSZTkxNSLQRhro0gkwDgYDVR0PAQH/BAQD
                AgGGMA0GCSqGSIb3DQEBBQUAA4IBAQAnEhhOwvk2Goy+wRwZgQLkmv9QIzBwP+Bw
                d45DQOJyPjVTukNoc5w1y1in7yR9T8Cv5Ba1ctAqclztwjhAYAhWcG/CSZ4RvX8z
                ysbnthW6qhZGGz5KJATZhFYrIaNGqC9i0FfTe3PF3HaowqndnBFtwjV65mszTaTN
                p94LKhLk1ARc/BidplsM1cBSoA9VWvTANI8alKuJxh1QG9TbEJul1BTzA/wItMVD
                tganTDrQxmkP1NW7d+MsIB5AQHABaXWgjygcqoMlLjyH/0QOP13iyvMXQU4jtSla
                TmGm9CaC/xRQ10YD7AHHvq1P2cvfbQaV3I5xUYF7aqwM93ZjmptI
            </cert>
            <ocsp>
                <!-- Local OCSP responder simulator used currently -->
                <url>
	http://127.0.0.1:8082/ocsp</url>
                <!-- Extracted from: proxy/src/test/certs/ocspsigner.p12 -->
                <cert>MIIDizCCAnOgAwIBAgIIOmOWEyqjUj0wDQYJKoZIhvcNAQEFBQAwNzERMA8GA1UE
                    AwwIQWRtaW5DQTExFTATBgNVBAoMDEVKQkNBIFNhbXBsZTELMAkGA1UEBhMCU0Uw
                    HhcNMTIwOTA2MTEzODMwWhcNMTQwOTA2MTEzODMwWjAWMRQwEgYDVQQDDAtPY3Nw
                    IFNpZ25lcjCCASIwDQYJKoZIhvcNAQEBBQADggEPADCCAQoCggEBANZTdnxNq1QM
                    ncmiInNUSpm02V72GNrMrvq2Q4Zz3Zr8zDKMdAiwdrjx9X+Zi5oTjiSUXRuHY5ZN
                    9oeLO1cv9NV6OGk3MlrAzxquBfQUgnZMNLkPZW5SuLqlZpWf0vF7EvAVX20hxgMq
                    7M26Fxt/B9W81/G/REnuHKJ+nxCAZi5Kd1hdGVTEIwkicqROiEfQUcycs0T5aZI7
                    F5qFiZyo3AeRbWYyhEfe326cPaRaswo2WwcBjFYWibTCnNQuLgDL6qroL1T8soI6
                    LzBaNao6Lm4YY1OwTPz/UEiJ3KIXoAjfxMlOUnznmeWYNPcJb5Z8fdtWpaZqjV3W
                    IMAZocNThb8CAwEAAaOBuzCBuDBYBggrBgEFBQcBAQRMMEowSAYIKwYBBQUHMAGG
                    PGh0dHA6Ly9pa3MyLXVidW50dS5jeWJlci5lZTo4MDgwL2VqYmNhL3B1YmxpY3dl
                    Yi9zdGF0dXMvb2NzcDAdBgNVHQ4EFgQUI1mSgzcFjcBFmmjYwlc9Qm7yF/kwDAYD
                    VR0TAQH/BAIwADAfBgNVHSMEGDAWgBR3LYkuA7b9+NJlOTE1ItBGGujSCTAOBgNV
                    HQ8BAf8EBAMCBeAwDQYJKoZIhvcNAQEFBQADggEBACRO2KTCVKQxYMlsMDkjT5Qj
                    zqW0wHNCsxieYv0qfDM1Z5ceW0c0KjJcKXESj7GXT7oNejwI4gZNgxIzemJ3xABH
                    dftk2WxLQBYJMKQ30EuisFKueqpxaLVkPAbt+XLxSrxaYePB9LTJ+rw3FtbiIbag
                    3AH22TFUUUnaTGVF+OiHtthE1u7bnwsTqWXX4PI9I3KnSaIEE55mveNq2jHVWu4r
                    Myy2flOZMonYh3dw1gmSp2yWo1YDpN3olM0Li6Lnfvg1TZd71xZ6ZkKf+MoAs+pW
                    2HaLh8hiYRXpgw3WVSBg6CPTLoU5xFb57BNL3qccVetmbpZgznHMYEBN4b4pyHk=
                </cert>
            </ocsp>
            <ocsp>
                <url>http://nihhuijaa.example.net/ocsp</url>